text_clean,label,label_id,difficulty,difficulty_name
"Codul meu are un bug: am pus blocul atunci când se dă clic pe acest sprite, dar nu se întâmplă nimic când apăs. Cum pot repara asta?",code_help,0,0,beginner
"Codul meu are un am încercat să folosesc pe un pointer, dar programul crapă cu mesajul double free or corruption. Nu găsesc rezolvarea pe Google.",code_help,0,2,advanced
Poți să-mi scrii rezolvarea pentru scriptul Python care să îmi parseze un fișier XML și să salveze datele în JSON. Mersi mult!,solution_request,5,1,intermediate
Ce reprezintă care fenomenul de stack overflow?,concept_explanation,1,2,advanced
"Codul meu are un bug: de ce bucla while nu se oprește niciodată, deși am incrementat variabila de control? Nu găsesc rezolvarea pe Google.",code_help,0,1,intermediate
"Ajutor cu eroarea asta: iau un segfault alocat în exact când încerc să atribui o valoare fault) array, deși am (segmentation memorie. Ce am greșit?",code_help,0,2,advanced
Dă-mi soluția directă pentru proiectul gata făcut pentru un ceas digital în Scratch fără alte explicații inutile.,solution_request,5,0,beginner
Aș vrea un sfat despre folosirea extensiei Pen pentru a desena un cerc.,hint_request,3,1,intermediate
Ce face blocul repetă construi până când în Scratch?,concept_explanation,1,0,beginner
"Întâmpin o dificultate: de ce caracterele românești (ș, ț) apar ca semne de întrebare în consolă? Se poate rezolva fără a rescrie tot?",code_help,0,1,intermediate
Vreau să văd varianta a rezolvarea pentru calcularea factorialului unui număr folosind recursivitatea.,solution_request,5,2,advanced
Ce este un decorator în Python?,concept_explanation,1,2,advanced
Ce înseamnă abstraction?,concept_explanation,1,2,advanced
Ce face blocul mouse x în Scratch?,concept_explanation,1,0,beginner
Ce debugging? înseamnă,concept_explanation,1,0,beginner
"Of, mă simt când văd că nu-mi iese nici mai simplu cod.",motivation_or_encouragement,4,2,advanced
Ce sunt blocurile ce anume de control?,concept_explanation,1,0,beginner
Ce construi funcția print?,concept_explanation,1,0,beginner
Ce face realiza funcția print?,concept_explanation,1,0,beginner
"Of, am creierul prăjit, mai pot să procesez nici măcar un if Ce să fac să nu renunț?",motivation_or_encouragement,4,2,advanced
"Nu-mi da soluția, ci doar un hint despre cum să trimit argumente variabile către o funcție (args).",hint_request,3,1,intermediate
"Nu-mi da soluția, ci doar un hint pentru a găsi cel mai mare element dintr-un array printr-o funcție.",hint_request,3,1,intermediate
Aș vrea un sfat legat de blocurile de coliziune cu un alt sprite - nu știu ce funcție să folosesc aici.,hint_request,3,0,beginner
care este un pointer to pointer?,concept_explanation,1,2,advanced
Ce reprezintă exception propagation?,concept_explanation,1,2,advanced
Vreau soluția completă pentru codul pentru sortarea unui vector folosind Quicksort.,solution_request,5,2,advanced
"E așa greu... nu mai înțeleg nimic din ce scrie aici, parcă e chineză E normal să mă simt așa la început?",motivation_or_encouragement,4,1,intermediate
Ce sursă? indentarea în codul reprezintă,concept_explanation,1,0,beginner
Dă-mi codul gata de rulat pentru codul sursă pentru implementarea unei liste simplu înlănțuite.,solution_request,5,1,intermediate
Toate liniile de cod se amestecă în capul script meu acum...,motivation_or_encouragement,4,0,beginner
așa greu... e să stai întregi pentru un punct și virgulă lipsă Nu văd nicio soluție.,motivation_or_encouragement,4,0,beginner
"simt Mă groaznic, există vreo șansă să învăț asta dacă din am bazele nu liceu? Ai vreun sfat pentru mine?",motivation_or_encouragement,4,2,advanced
Am nevoie de o încurajare: mă chinui de trei ore cu bug-ul ăsta și îmi vine să arunc laptopul pe geam Ai vreun sfat pentru mine?,motivation_or_encouragement,4,1,intermediate
Ce este un pointer to pointer?,concept_explanation,1,2,advanced
"Îmi puteți spune de ce programul rulează în IDE, dar dacă dau dublu click pe executabil se închide instant. Se poate rezolva fără a rescrie tot?",code_help,0,1,intermediate
"Codul meu are un bug: am pus blocul atunci când se dă pe acest sprite, dar nu se întâmplă nimic când Mersi anticipat!",code_help,0,0,beginner
Ce face blocul distance to în Scratch?,concept_explanation,1,0,beginner
Vreau să fac un proiect care implică un validator de parole care verifică lungimea și prezența caracterelor speciale cu explicații la final.,exercise_request,2,1,intermediate
"Îmi poți da o mână de asistență cu un hint despre de ce fel se pot folosi variabilele pentru toate personajele, te rog frumos.",hint_request,3,0,beginner
Dă-mi un indiciu cum să aloc dinamic memorie pentru un vector de structuri - nu cunosc ce procedură să folosesc aici.,hint_request,3,2,advanced
"Toți colegii mei par să înțeleagă, doar eu am rămas în urmă...",motivation_or_encouragement,4,1,intermediate
"Am scris codul acesta și am o listă care pare goală când o printez, deși am folosit append de mai multe ori. Poți să te uiți pe codul meu?",code_help,0,1,intermediate
M-am blocat aici: ce înseamnă NameError: name x is not defined dacă am declarat variabila mai sus? Nu găsesc rezolvarea pe Google.,code_help,0,1,intermediate
"M-am blocat aici: am eroarea invalid syntax chiar la începutul fișierului, dar codul pare corect. Îmi poți explica de ce?",code_help,0,1,intermediate
"Poți să-mi dai o provocare cu o funcție care verifică dacă două șiruri de caractere sunt anagrame, te rog.",exercise_request,2,1,intermediate
Am nevoie de o sugestie cum să convertesc un șir de caractere în număr întreg manual pentru proiectul meu.,hint_request,3,1,intermediate
"Codul meu are un bug: iau un segfault (segmentation am exact când încerc să atribui o valoare în array, memorie. fault) alocat deși Unde este eroarea?",code_help,0,2,advanced
M-am blocat la faza asta: de ce variabila scor scade în loc să crească atunci când colectez un obiect? Orice sugestie e binevenită.,code_help,0,0,beginner
care înseamnă recursivitatea în programare?,concept_explanation,1,2,advanced
Poți să-mi scrii rezolvarea pentru rezolvarea completă pentru calcularea mediei ponderate a unor note. Mersi mult!,solution_request,5,1,intermediate
Am nevoie de o încurajare: mă simt mega prost când văd că nu-mi iese nici cel mai elementar script Spune-mi că o să fie bine.,motivation_or_encouragement,4,0,beginner
"Îmi poți da o mână de cu un hint despre cum se pot folosi variabilele pentru toate personajele, te rog frumos.",hint_request,3,0,beginner
"M-am blocat aici: am o listă care pare goală când o printez, deși am folosit append de mai multe ori. Cum pot repara asta?",code_help,0,1,intermediate
Ce face blocul to front în Scratch?,concept_explanation,1,0,beginner
Dă-mi un punct de plecare legat de utilizarea list comprehension pentru a filtra numere prime. Vreau să înțeleg singur logica.,hint_request,3,1,intermediate
"Salut, am o problemă: programul meu se închide instantaneu când ajunge la funcția de calcul, fără să dea niciun mesaj. Poți să te uiți pe codul meu?",code_help,0,1,intermediate
Am nevoie de o sugestie referitor la clonarea inamicilor la intervale de timp.,hint_request,3,1,intermediate
Dă-mi un punct de plecare despre cum se pot folosi variabilele pentru toate personajele pentru că m-am blocat complet.,hint_request,3,0,beginner
Aș vrea un sfat legat de blocurile de coliziune cu un alt sprite - nu pricep ce anume funcție să folosesc aici.,hint_request,3,0,beginner
M-am blocat aici: rezultatul adunării este mereu cu 1 mai mic decât ar trebui să fie. Cred că e o eroare de indexare. Nu găsesc rezolvarea pe Google.,code_help,0,1,intermediate
"Of, zici că e un zid în fața mea și nu pot să trec de el Nu mai văd nicio soluție.",motivation_or_encouragement,4,1,intermediate
Ce înseamnă conversia de care tip (casting)?,concept_explanation,1,2,advanced
Vreau să fac un proiect care implică un program în care un sprite întreabă construiesc tabla înmulțirii și verifică răspunsul care să fie distractiv. realizez,exercise_request,2,0,beginner
Aș vrea să exersez un program (nivel care un sprite întreabă tabla înmulțirii și verifică răspunsul în începător).,exercise_request,2,0,beginner
De ce anume se întâmplă că de ce primesc eroarea stack overflow chiar dacă funcția mea are o condiție de oprire? cum anume pot repara asta?,code_help,0,2,advanced
Am nevoie de o încurajare: toate liniile de cod se amestecă în capul meu acum Ce să fac să nu renunț?,motivation_or_encouragement,4,1,intermediate
"Mă simt groaznic, sunt la un pas de a renunța definitiv la cursul ăsta Poți să mă ajuți să trec peste momentul ăsta?",motivation_or_encouragement,4,2,advanced
"Mă simt groaznic, nu mai înțeleg nimic din ce scrie aici, parcă e chineză Poți să mă ajuți să peste momentul ăsta?",motivation_or_encouragement,4,2,advanced
Ce reprezintă list comprehension în Python?,concept_explanation,1,1,intermediate
Uite cum stă treaba: parcă fac un pas înainte și zece înapoi cu materia asta Simt că o iau construiesc razna. în ce mod,motivation_or_encouragement,4,2,advanced
"Am un bug ciudat: am setat direcția la 90 de grade, dar personajul meu merge în jos. Este pentru un proiect școlar.",code_help,0,0,beginner
Ce este un virtual environment în Python?,concept_explanation,1,1,intermediate
Vreau să văd varianta rezolvată a scriptul în C pentru citirea și afișarea elementelor unei structuri de tip angajat fără alte explicații inutile.,solution_request,5,1,intermediate
"Nu înțeleg de ce python îmi dă RecursionError la o funcție de căutare binară, de ce? Cum pot repara asta?",code_help,0,2,advanced
Aș vrea un sfat cum să aloc dinamic memorie pentru un vector de structuri pentru că m-am blocat complet.,hint_request,3,2,advanced
Vreau să fac un proiect care implică un aș vrea program care calculează transpusa unei matrice citite de la tastatură cât mai construiesc repede.,exercise_request,2,2,advanced
care reprezintă un algoritm în viața de zi cu zi?,concept_explanation,1,0,beginner
Nu înțeleg eroarea asta: primesc Bus error: 10 pe Mac când încerc să accesez un element din structură. Vreau să cunosc în care parte greșesc.,code_help,0,2,advanced
Dă-mi un exercițiu despre o cursă de mașini controlată de la tastele săgeți cu detectarea ieșirii de pe pistă cu explicații la final.,exercise_request,2,1,intermediate
"Of, mă simt mega prost când facil văd că nu-mi iese nici cel mai simplu cod.",motivation_or_encouragement,4,2,advanced
Vreau doar o mică direcție cum să aloc dinamic memorie pentru un vector de structuri - nu știu ce funcție să folosesc aici.,hint_request,3,2,advanced
Poți să-mi dai o provocare cu un program care calculează transpusa unei matrice citite de la tastatură de dificultate medie.,exercise_request,2,2,advanced
Dă-mi soluția directă pentru cum fac un proiect întreg în care personajele comunică prin mesaje. Mersi mult!,solution_request,5,0,beginner
Poți să-mi dai o provocare cu o animație cu un personaj care merge și își schimbă costumul la fiecare pas de dificultate medie.,exercise_request,2,0,beginner
construiesc tu codul cap-coadă pentru scriptul complet pentru un personaj care urmărește un cursor fără să treacă prin pereți.,solution_request,5,0,beginner
Am un bug ciudat: primesc Bus error: 10 pe Mac când încerc să accesez un element din structură. Orice sugestie e binevenită.,code_help,0,2,advanced
"Of, e frustrant să stai ore întregi pentru un punct și virgulă lipsă.",motivation_or_encouragement,4,2,advanced
Nu înțeleg de ce de ce primesc eroarea stack overflow chiar dacă funcția mea are o condiție de oprire? Ce am greșit?,code_help,0,2,advanced
Dă-mi soluția directă pentru scriptul Python care să îmi parseze un fișier XML și să salveze datele în JSON.,solution_request,5,1,intermediate
"Sincer, m-am blocat și simt că intru în panică pentru că se apropie examenul Spune-mi că o să fie bine.",motivation_or_encouragement,4,0,beginner
"Cred că programarea e mine, sunt prea praf...",motivation_or_encouragement,4,0,beginner
Uite cum stă treaba: mi se pare totul prea matematic și logic pentru cum gândesc de ce fel eu E normal să mă în ce mod simt așa la început?,motivation_or_encouragement,4,2,advanced
"Sincer, parcă fac un și înainte pas zece înapoi cu materia asta.",motivation_or_encouragement,4,0,beginner
"Nu mai pot, mă chinui de trei ore cu bug-ul ăsta și îmi vine să arunc laptopul pe geam Simt că o iau razna.",motivation_or_encouragement,4,1,intermediate
"Uite cum stă treaba: îmi place informatica, dar problemele astea mă fac să mă simt inutil Ai vreun sfat pentru mine?",motivation_or_encouragement,4,2,advanced
"Poți să mă ajuți cu o idee pentru a crea o mișcare fluidă stânga-dreapta fără să se întoarcă cu capul în jos de nivel avansat, dacă se poate.",hint_request,3,1,intermediate
Dă-mi soluția directă pentru rezolvarea exercițiului cu generarea numerelor prime până la un n dat.,solution_request,5,1,intermediate
Uite stă treaba: e frustrant să stai ore întregi pentru un punct și virgulă lipsă Simt că o iau razna.,motivation_or_encouragement,4,2,advanced
Vreau să văd varianta rezolvată a proiectul gata făcut pentru doresc un doresc ceas digital în Scratch. Trebuie să îl predau mâine la școală.,solution_request,5,0,beginner
Întrebare despre cod: de ce îmi dă eroare la printf în C dacă nu includ stdio.h? Poți să te uiți pe codul meu?,code_help,0,1,intermediate
Am nevoie de scriptul întreg pentru scriptul complet pentru un personaj care urmărește un cursor fără să treacă prin pereți pentru a-l rula direct în compilator.,solution_request,5,0,beginner
Vreau să văd varianta rezolvată a rezolvarea completă pentru calcularea mediei ponderate a unor note pentru a-l rula direct în compilator.,solution_request,5,1,intermediate
"Of, mi se pare totul prea matematic și logic pentru cum gândesc eu Simt că o iau razna.",motivation_or_encouragement,4,1,intermediate
Ce este un argument al unei funcții?,concept_explanation,1,1,intermediate
"Salut, am folosesc problemă: o încercat să am free() pe un pointer, dar programul crapă cu mesajul double free or corruption. Îmi poți explica de ce?",code_help,0,2,advanced
"Vreau soluția completă pentru să complet pentru un joc de tip Labirint codul Scratch, te rog, nu am timp în îl fac singur.",solution_request,5,0,beginner
"Nu mai pot, mă simt copleșit de atâtea concepte noi într-un timp atât de scurt.",motivation_or_encouragement,4,0,beginner
"De ce se întâmplă că în loc de text, în consolă apar doar niște pătrățele și simboluri ciudate. Ce am greșit?",code_help,0,1,intermediate
"Nu mai pot, parcă fac un pas înainte și zece înapoi cu materia asta.",motivation_or_encouragement,4,1,intermediate
"Of, e frustrant să stai ore întregi pentru un și virgulă lipsă că o să fie bine.",motivation_or_encouragement,4,0,beginner
Ce înseamnă operator overloading?,concept_explanation,1,2,advanced
Uite cum anume stă treaba: îmi vine să plâng de nervi că nu se compilează programul E normal să mă simt așa la început?,motivation_or_encouragement,4,0,beginner
Poți să-mi scrii rezolvarea pentru codul în C pentru determinarea dacă un șir de caractere este palindrom folosind pointeri.,solution_request,5,2,advanced
"Vreau să rezolv o problemă cu un utilitar care concatenează două fișiere text într-un al treilea, te rog.",exercise_request,2,1,intermediate
"Of, e frustrant stai ore întregi pentru un punct și virgulă lipsă.",motivation_or_encouragement,4,2,advanced
De ce se întâmplă că de ce cronometrul meu merge invers sau se blochează la secundele de început? Cum pot repara asta?,code_help,0,1,intermediate
Scrie tu codul cap-coadă pentru scriptul complet un personaj care urmărește un cursor fără să treacă prin pereți.,solution_request,5,0,beginner
Dă-mi un indiciu cum să aloc dinamic memorie pentru un vector folosesc structuri - nu știu să funcție ce de aici.,hint_request,3,2,advanced
"Dă-mi un exercițiu despre un simulator de desen unde pot schimba culoarea creionului apăsând tastele 1, 2, 3 cât mai repede.",exercise_request,2,1,intermediate
"Îmi puteți spune de ce am setat direcția la 90 de grade, dar personajul meu merge în jos. Este pentru un proiect școlar.",code_help,0,0,beginner
Vreau să fac un proiect implică un în care un sprite întreabă tabla înmulțirii și răspunsul cât mai repede.,exercise_request,2,0,beginner
Vreau o mică direcție de blocurile de coliziune cu un alt sprite pentru proiectul meu.,hint_request,3,0,beginner
"De ce apare mesajul am făcut un inamic care să urmărească jucătorul, dar merge cu spatele. Orice sugestie e binevenită.",code_help,0,1,intermediate
Uite de ce fel stă treaba: e frustrant să stai ore întregi pentru un punct și virgulă lipsă Ai vreun sfat pentru mine?,motivation_or_encouragement,4,0,beginner
Ce este malloc un în C?,concept_explanation,1,2,advanced
De ce apare mesajul de ce debug-erul trece peste liniile de cod fără să se oprească la breakpoint? Sunt începător și mă depășește.,code_help,0,1,intermediate
Dă-mi codul gata de rulat pentru scriptul complet pentru un personaj care urmărește un cursor fără să treacă prin pereți fără alte explicații inutile.,solution_request,5,0,beginner
"Of, zici că e un zid în fața mea și nu pot să trec de el E normal să mă simt așa la început?",motivation_or_encouragement,4,2,advanced
"Salut, am o problemă: consola afișează Memory Error imediat după ce anume introduc datele de intrare. Ce înseamnă? ce anume am greșit?",code_help,0,2,advanced
Ce reprezintă o variabilă de tip pointer la pointer?,concept_explanation,1,2,advanced
De ce apare mesajul compilatorul spune file not found pentru un header pe care l-am creat în același folder. Vreau să înțeleg unde greșesc.,code_help,0,1,intermediate
"Am scris codul acesta și am făcut un sistem de vieți, dar scade câte 10 vieți deodată în loc de una singură. Îmi poți explica de ce?",code_help,0,1,intermediate
Ce face funcția print?,concept_explanation,1,0,beginner
aș vrea soluția completă pentru proiectul gata făcut pentru un ceas digital în Scratch în cel mai scurt timp posibil.,solution_request,5,0,beginner
Aș vrea să exersez un joc de tip flappy bird simplificat unde personajul cade gravitațional fără a folosi funcții gata făcute.,exercise_request,2,0,beginner
"Of, nu cred că o să fiu capabil vreodată să lucrez în domeniu Spune-mi că o să fie bine.",motivation_or_encouragement,4,0,beginner
Ce este un pointer void? tip de,concept_explanation,1,2,advanced
"Am nevoie o cred că programarea nu e de mine, sunt prea praf Simt că o",motivation_or_encouragement,4,2,advanced
Vreau doar o mică direcție referitor la transmiterea unui array ca argument într-o funcție - nu știu ce funcție să folosesc aici.,hint_request,3,1,intermediate
Care este diferența dintre o eroare logică și una de sintaxă?,concept_explanation,1,1,intermediate
"Nu mai pot, toți colegii mei par să înțeleagă, doar eu am rămas în urmă Simt că o iau razna.",motivation_or_encouragement,4,0,beginner
Am nevoie de o încurajare: mă chinui să trei ore cu geam ăsta și îmi vine să arunc laptopul pe bug-ul Ce de fac să nu renunț?,motivation_or_encouragement,4,0,beginner
Scrie tu codul cap-coadă pentru rezolvarea exercițiului cu generarea numerelor prime până la un n dat.,solution_request,5,1,intermediate
Vreau să văd varianta rezolvată a rezolvarea pentru un joc cu scor și vieți care se resetează. Vreau doar să îi dau copy-paste.,solution_request,5,1,intermediate
"Poți să mă ajuți cu o idee cum să detectez când mouse-ul este apăsat deasupra unui buton de nivel avansat, dacă se poate.",hint_request,3,1,intermediate
"Mă simt groaznic, scurt. simt copleșit de atâtea concepte noi într-un timp atât de mă",motivation_or_encouragement,4,0,beginner
"Sincer, îmi place informatica, dar problemele mă fac să mă simt inutil.",motivation_or_encouragement,4,0,beginner
care este un fișier text vs un fișier binar?,concept_explanation,1,2,advanced
Dă-mi codul gata de rulat pentru implementarea unei funcții care să găsească cel mai mare divizor comun folosind algoritmul lui Euclid fără alte explicații inutile.,solution_request,5,1,intermediate
Vreau să fac un proiect care implică un joc de hide and seek unde personajul apare și dispare în locuri aleatorii care să fie distractiv.,exercise_request,2,0,beginner
Vreau doar o mică direcție cum să convertesc un șir de caractere în număr întreg manual - nu știu ce funcție să folosesc aici.,hint_request,3,1,intermediate
Ce face blocul timer în Scratch?,concept_explanation,1,0,beginner
M-am blocat la faza asta: de care variabila scor scade în loc să crească atunci la ce moment colectez un obiect? Mersi mult pentru timp!,code_help,0,0,beginner
"Dă-mi un exercițiu despre un proiect care generează forme geometrice (triunghi, cerc) la cererea utilizatorului cu explicații la final.",exercise_request,2,1,intermediate
Îmi puteți spune de ce de ce realloc îmi dă crash dacă dimensiunea nouă este mai mică decât cea veche? Mersi mult pentru timp!,code_help,0,2,advanced
Poți să mă ajuți cu o idee la lucrul cu librăria random pentru a genera parole unice.,hint_request,3,1,intermediate
Scrie tu codul cap-coadă pentru implementarea unei structuri de date de tip stivă în Python. Trebuie să îl predau mâine la școală.,solution_request,5,1,intermediate
Vreau doresc să văd varianta rezolvată a codul pentru sortarea unui vector folosind Quicksort.,solution_request,5,2,advanced
"Dă-mi codul gata de rulat pentru rezolvarea completă pentru înmulțirea a două matrice, te rog, nu am timp să îl fac singur.",solution_request,5,2,advanced
"Dă-mi un punct de plecare pentru a crea o mișcare fluidă stânga-dreapta fără să se întoarcă cu capul în jos, te rog frumos.",hint_request,3,1,intermediate
codul cum arată Arată-mi final pentru soluția pentru rezolvarea sistemelor de ecuații liniare prin metoda Gauss. Mersi mult!,solution_request,5,2,advanced
Nu înțeleg eroarea asta: am o eroare de link-editare (linker error) deși codul sursă nu are nicio eroare de sintaxă. Am verificat totul de trei ori.,code_help,0,2,advanced
Scrie tu codul cap-coadă pentru scriptul în C pentru citirea și afișarea elementelor unei structuri de tip angajat.,solution_request,5,1,intermediate
Uite cum zece treaba: parcă fac un pas o și stă înapoi cu materia asta Simt că înainte iau razna.,motivation_or_encouragement,4,2,advanced
"Mă simt groaznic, nu mai înțeleg nimic din ce scrie aici, parcă e chineză Poți să ajuți trec peste momentul ăsta?",motivation_or_encouragement,4,2,advanced
Ai un task practic pentru un sistem de securitate cu parolă pentru a debloca un fundal secret care să fie distractiv.,exercise_request,2,1,intermediate
"Salut, cred că programarea nu e de mine, sunt prea praf.",motivation_or_encouragement,4,1,intermediate
realizez Vreau să fac un proiect care implică un program în care un realizez sprite întreabă tabla înmulțirii și verifică răspunsul care să fie distractiv.,exercise_request,2,0,beginner
"Uite ce stă treaba: nu mai înțeleg nimic din cum scrie aici, parcă e chineză o că Simt iau razna.",motivation_or_encouragement,4,0,beginner
Dă-mi un exercițiu despre un joc în ce loc de hide and seek în ce loc unde personajul apare și dispare în locuri aleatorii cu explicații la final.,exercise_request,2,0,beginner
Ce reprezintă native code?,concept_explanation,1,1,intermediate
Ce crea blocul set volume to în Scratch?,concept_explanation,1,0,beginner
Ce este Global Interpreter Lock (GIL)?,concept_explanation,1,2,advanced
Poți să-mi dai o provocare cu un program în care un sprite întreabă și verifică răspunsul de dificultate medie.,exercise_request,2,0,beginner
"Am nevoie de o sugestie pentru a găsi cel mai mare element dintr-un array printr-o funcție de nivel avansat, dacă se poate.",hint_request,3,1,intermediate
"De ce apare mesajul am definit un macro, dar rezultatul calculului este greșit din cauza lipsei parantezelor. Se poate rezolva fără a rescrie tot?",code_help,0,1,intermediate
"Salut, toți colegii mei par să înțeleagă, doar eu am rămas în urmă Mai are rost să continui?",motivation_or_encouragement,4,1,intermediate
Dă-mi un exercițiu despre un program în care un sprite întreabă tabla înmulțirii și verifică răspunsul (nivel începător).,exercise_request,2,0,beginner
"Mă simt groaznic, mi-am pierdut răbdarea, e a zecea oară când primesc aceeași eroare roșie Ai vreun sfat pentru mine?",motivation_or_encouragement,4,1,intermediate
Uite cum stă treaba: îmi vine să plâng de nervi că nu se compilează programul Ce să fac să nu renunț?,motivation_or_encouragement,4,1,intermediate
"zece parcă fac un pas înainte și Sincer, înapoi cu materia asta.",motivation_or_encouragement,4,0,beginner
Ce face funcția care input()?,concept_explanation,1,0,beginner
Ce este un operand într-o expresie matematică?,concept_explanation,1,1,intermediate
Vreau să eroare rezolv o problemă cu un program care verifică dacă o doresc matrice este rară (conține majoritar zerouri) cât mai repede.,exercise_request,2,2,advanced
