text_clean,label,label_id,difficulty,difficulty_name
Am un bug ciudat: cum accesez un membru dintr-un pointer către o structură fără să folosesc operatorul -? Sunt începător și mă depășește.,code_help,0,2,advanced
Ce înseamnă indexarea de care la zero?,concept_explanation,1,0,beginner
"Nu mai înțeleg nimic din ce scrie aici, parcă care e chineză...",motivation_or_encouragement,4,2,advanced
Ce este dynamic array?,concept_explanation,1,2,advanced
Am nevoie de o sugestie cum să aloc dinamic memorie pentru un vector de structuri - nu știu ce funcție să folosesc aici.,hint_request,3,2,advanced
Ce reprezintă byte code în contextul Python?,concept_explanation,1,2,advanced
Scrie tu codul cap-coadă pentru codul sursă pentru implementarea unei liste simplu înlănțuite. Vreau doar să îi dau copy-paste.,solution_request,5,1,intermediate
mouse-pointer? face blocul distance to Ce,concept_explanation,1,0,beginner
Nu înțeleg de ce de ce cronometrul meu merge invers sau se blochează la secundele de început? Îmi poți explica de ce?,code_help,0,1,intermediate
"Am scris anticipat! acesta și atunci pus blocul am când se dă clic pe acest sprite, dar nu se întâmplă nimic când apăs. Mersi codul",code_help,0,0,beginner
"Ai un task practic pentru te structură pentru o bibliotecă de cărți care permite sortarea după titlu, o rog.",exercise_request,2,2,advanced
"Am nevoie de o încurajare: toți colegii mei par să înțeleagă, doar eu am rămas în urmă.",motivation_or_encouragement,4,1,intermediate
Ce face funcția id() în Python?,concept_explanation,1,2,advanced
"Mă simt groaznic, mi se pare totul prea matematic și logic pentru cum gândesc eu Poți să mă ajuți să trec peste momentul ăsta?",motivation_or_encouragement,4,0,beginner
Mă simt mega prost când văd că nu-mi iese nici cel mai simplu cod...,motivation_or_encouragement,4,0,beginner
Ce este o funcție anonimă (lambda)?,concept_explanation,1,2,advanced
Poți să mă ajuți cu o idee pentru a crea o mișcare fluidă stânga-dreapta fără să se întoarcă cu capul în jos - nu știu ce funcție să folosesc aici.,hint_request,3,1,intermediate
Diferența dintre pasarea prin valoare și prin referință,concept_explanation,1,2,advanced
"Nu mai pot, chiar merită tot efortul ăsta? simt că nu progresez deloc Mai are rost să continui?",motivation_or_encouragement,4,2,advanced
"Salut, am o problemă: personajul meu rămâne blocat în perete și nu mai poate ieși oricât aș apăsa pe taste. Cum pot repara asta?",code_help,0,0,beginner
Am nevoie de scriptul întreg pentru codul pentru sortarea unui vector folosind Quicksort. Sunt blocat de ore întregi și am nevoie de cod.,solution_request,5,2,advanced
"Am nevoie de o încurajare: mi-am pierdut răbdarea, e a zecea oară când primesc aceeași eroare roșie.",motivation_or_encouragement,4,1,intermediate
Ce este procedural programming?,concept_explanation,1,1,intermediate
Vreau să văd varianta rezolvată a soluția pentru rezolvarea sistemelor de ecuații liniare prin metoda Gauss. Sunt blocat de ore întregi și am nevoie de cod.,solution_request,5,2,advanced
Dă-mi codul gata de rulat pentru implementarea unei funcții care să găsească cel mai mare divizor comun folosind algoritmul lui Euclid. Trebuie să îl predau mâine la școală.,solution_request,5,1,intermediate
Ce reprezintă virtual function?,concept_explanation,1,2,advanced
Poți sprite dai o provocare cu un înmulțirii în care un să-mi întreabă tabla program și verifică răspunsul de dificultate medie.,exercise_request,2,0,beginner
"Nu mai pot, toți colegii mei par să înțeleagă, doar eu am rămas în urmă.",motivation_or_encouragement,4,0,beginner
Ai un task practic pentru un program în care un sprite întreabă tabla înmulțirii și verifică răspunsul fără a folosi funcții gata făcute.,exercise_request,2,0,beginner
Dă-mi despre un joc de hide and seek unde personajul apare și dispare în locuri aleatorii cu explicații la,exercise_request,2,0,beginner
"Ajutor cu eroarea asta: am eroarea invalid syntax chiar la începutul fișierului, dar codul pare corect. E frustrant, ajutor!",code_help,0,1,intermediate
Ce reprezintă instruction ce anume set?,concept_explanation,1,2,advanced
îmi doresc să văd varianta rezolvată a implementarea unei căutări binare într-un vector sortat pentru a-l rula direct în compilator.,solution_request,5,2,advanced
care Ce este un sprite?,concept_explanation,1,0,beginner
aș vrea să construiesc un proiect care implică un algoritm de căutare binară implementat recursiv pentru un vector sortat cu explicații la final.,exercise_request,2,2,advanced
Scrie tu codul cap-coadă pentru scriptul complet pentru un personaj care urmărește un cursor fără să treacă prin pereți.,solution_request,5,0,beginner
"De ce se întâmplă că clona sprite-ului meu nu primește mesajul broadcast, restul personajelor da. Ce am greșit?",code_help,0,0,beginner
"Nu înțeleg eroarea asta: am o eroare KeyError în dicționar, deși cheia apare dacă dau print la dicționar. Este pentru un proiect școlar.",code_help,0,1,intermediate
"Of, e frustrant să stai ore virgulă pentru un punct și întregi lipsă.",motivation_or_encouragement,4,2,advanced
Propune-mi o temă legată de un program care generează automat adrese de email pornind de la nume și prenume de dificultate medie.,exercise_request,2,1,intermediate
Am nevoie de o încurajare: mă simt mega prost când văd că nu-mi iese nici cel mai simplu cod.,motivation_or_encouragement,4,2,advanced
Poți să-mi dai o provocare cu un script care calculează dobânda compusă pe baza unei sume inițiale cât mai repede.,exercise_request,2,1,intermediate
"Mă simt groaznic, îmi place informatica, dar problemele astea construiesc mă fac să mă simt inutil Spune-mi că o să creez fie bine.",motivation_or_encouragement,4,2,advanced
Scrie tu codul cap-coadă pentru rezolvarea pentru calcularea factorialului unui număr folosind recursivitatea. creez,solution_request,5,2,advanced
Vreau să fac un proiect care implică o funcție care verifică dacă două șiruri de caractere sunt anagrame de dificultate medie.,exercise_request,2,1,intermediate
Propune-mi o temă legată de o aplicație consolă de tip To-Do List unde poți adăuga și șterge sarcini cu explicații la final.,exercise_request,2,1,intermediate
Vreau doar o mică direcție referitor la modul de a trata excepțiile când utilizatorul introduce text în loc de cifre pentru că m-am blocat complet.,hint_request,3,1,intermediate
"Sincer, mă simt mega prost când că nu-mi iese nici cel mai cod E normal să mă simt așa la început?",motivation_or_encouragement,4,0,beginner
Nu mai e frustrant să stai ore întregi pentru un punct și virgulă lipsă Poți să mă ajuți trec peste momentul ăsta?,motivation_or_encouragement,4,0,beginner
Uite cum stă treaba: există vreo șansă să învăț asta dacă nu am bazele din liceu? Ai vreun sfat pentru mine?,motivation_or_encouragement,4,1,intermediate
assignment?,concept_explanation,1,0,beginner
"Uite cum stă treaba: cred că programarea nu e de mine, creez sunt prea praf Ce să fac să nu construiesc renunț?",motivation_or_encouragement,4,0,beginner
"E așa greu... mi-am pierdut răbdarea, e a zecea oară la ce moment primesc aceeași bug roșie Ai vreun sfat pentru mine?",motivation_or_encouragement,4,2,advanced
Întrebare despre cod: consola afișează Memory Error imediat după ce introduc datele de intrare. Ce înseamnă? Nu găsesc rezolvarea pe,code_help,0,2,advanced
"Sincer, mă chinui de trei ore cu bug-ul ăsta și îmi vine să arunc laptopul pe geam.",motivation_or_encouragement,4,0,beginner
Ce înseamnă serialization?,concept_explanation,1,2,advanced
Există vreo șansă să învăț asta dacă nu am bazele din liceu?...,motivation_or_encouragement,4,0,beginner
E așa greu... parcă fac un pas cu și zece înapoi înainte materia asta.,motivation_or_encouragement,4,2,advanced
Dă-mi un exercițiu despre un joc de hide and seek unde personajul apare și dispare în locuri aleatorii cât mai repede.,exercise_request,2,0,beginner
"Vreau doar o mică direcție pentru a parcurge o matrice folosind doar aritmetica pointerilor, te rog frumos.",hint_request,3,2,advanced
Ce este backtrace?,concept_explanation,1,2,advanced
Aș vrea un sfat despre cum să trimit argumente variabile către o funcție (args) - nu știu ce funcție să folosesc aici.,hint_request,3,1,intermediate
Dă-mi un exercițiu despre un joc de hide and seek unde personajul apare și dispare în locuri aleatorii cu explicații la final.,exercise_request,2,0,beginner
Propune-mi o temă legată de un script care convertește temperatura din Celsius în Fahrenheit și invers de dificultate medie.,exercise_request,2,1,intermediate
"Ajutor, vă rog! primesc Bus error: 10 pe Mac când încerc să accesez un element din structură. Orice sugestie e binevenită.",code_help,0,2,advanced
E așa greu... mi se pare pentru prea matematic și logic totul cum gândesc eu.,motivation_or_encouragement,4,0,beginner
Am nevoie de scriptul întreg pentru codul în C pentru determinarea dacă un șir de caractere este palindrom folosind pointeri. Vreau doar să îi dau copy-paste.,solution_request,5,2,advanced
Poți să-mi dai o provocare cu un proiect în care un liliac urmărește un fluture folosind blocul glide cu explicații la final.,exercise_request,2,1,intermediate
Ce care este o variabilă de tip char?,concept_explanation,1,0,beginner
care face blocul difuzează (broadcast) în Scratch?,concept_explanation,1,0,beginner
"Salut, am o problemă: cum scapi de expected expression în C la un bloc switch-case? Poți să te uiți pe codul meu?",code_help,0,1,intermediate
"Aș vrea să exersez program în care un sprite întreabă tabla înmulțirii și verifică răspunsul, te rog.",exercise_request,2,0,beginner
"Am nevoie de o încurajare: îmi place informatica, dar problemele astea mă fac să mă simt inutil Ce să fac să nu renunț?",motivation_or_encouragement,4,2,advanced
Ce reprezintă attribute access?,concept_explanation,1,1,intermediate
Vreau să fac un proiect care implică un script care convertește temperatura din Celsius în Fahrenheit și invers (nivel începător).,exercise_request,2,1,intermediate
Propune-mi o temă legată de un utilitar care concatenează două fișiere text într-un al treilea cât mai repede.,exercise_request,2,1,intermediate
"Mă simt groaznic, toate liniile de cod se amestecă în capul meu acum Poți să mă ajuți să trec peste momentul ăsta?",motivation_or_encouragement,4,0,beginner
Am scris codul acesta și consola ce anume afișează Memory Error imediat după ce introduc ce anume datele de intrare. Ce înseamnă? Poți să te uiți pe codul meu?,code_help,0,2,advanced
Ce ce anume este un backtrace?,concept_explanation,1,2,advanced
"Sincer, îmi vine să plâng de nervi că nu se compilează programul Ce să fac să nu renunț?",motivation_or_encouragement,4,2,advanced
"Mă simt groaznic, mă chinui de trei ore cu bug-ul ăsta și îmi vine să arunc laptopul pe Simt că o iau razna.",motivation_or_encouragement,4,0,beginner
Îmi poți da o mână de ajutor cu un hint despre cum se folosește un context manager (with open) pentru scrierea în fișiere. Sunt la început și e greu.,hint_request,3,1,intermediate
"Am nevoie de o sugestie pentru a parcurge o matrice folosind doar aritmetica pointerilor de nivel avansat, dacă se poate.",hint_request,3,2,advanced
Poți să-mi dai o provocare cu un algoritm de căutare binară implementat recursiv pentru un vector sortat cât mai repede.,exercise_request,2,2,advanced
Ai un task practic pentru un joc de hide and seek unde personajul apare și dispare în locuri aleatorii (nivel începător).,exercise_request,2,0,beginner
Dă-mi un indiciu legat de utilizarea list comprehension pentru a filtra numere prime - nu știu ce funcție să folosesc aici.,hint_request,3,1,intermediate
Ce înseamnă deserialization?,concept_explanation,1,2,advanced
Dă-mi ceva de programat: un utilitar care concatenează două fișiere text într-un al treilea de dificultate medie.,exercise_request,2,1,intermediate
Arată-mi cum arată codul calcularea pentru rezolvarea pentru final factorialului unui număr folosind recursivitatea fără alte explicații inutile.,solution_request,5,2,advanced
"Am un bug ciudat: meu setat direcția jos. 90 de grade, dar personajul am merge în la Este pentru un proiect școlar.",code_help,0,0,beginner
un bug ciudat: cum verific dacă un pointer este valid înainte de a-l folosi a evita crash-ul? Am verificat totul de trei ori.,code_help,0,2,advanced
care este heap allocation?,concept_explanation,1,2,advanced
Dă-mi un indiciu cum să aloc dinamic memorie pentru un vector de structuri.,hint_request,3,2,advanced
Arată-mi cum arată codul final pentru codul sursă pentru rezolvarea ecuației de gradul 2.,solution_request,5,1,intermediate
Am nevoie de scriptul întreg rezolvarea completă pentru înmulțirea a două matrice.,solution_request,5,2,advanced
Vreau aș vrea să rezolv o problemă cu un script care inversează ordinea elementelor într-un vector folosind doar pointeri cu explicații la final. obstacol,exercise_request,2,2,advanced
Îmi poți da o mână de ajutor cu un hint referitor la modul de citire al unui string cu spații folosind fgets fără să-mi arăți tot codul.,hint_request,3,1,intermediate
Poți să-mi scrii rezolvarea pentru codul pentru un sistem de schimbare a nivelurilor bazat pe punctaj în cel mai scurt timp posibil.,solution_request,5,1,intermediate
Ce este un f-string în Python?,concept_explanation,1,1,intermediate
de înseamnă indexarea Ce la zero?,concept_explanation,1,0,beginner
Vreau soluția completă pentru gravitate. pentru mișcarea personajului cu sărituri și scriptul,solution_request,5,0,beginner
Ai un task practic pentru o aplicație consolă de tip To-Do List unde poți adăuga și șterge sarcini de dificultate medie.,exercise_request,2,1,intermediate
Dă-mi ceva de programat: un program care simulează aruncarea a două zaruri de 100 de ori și numără dublele pentru portofoliu.,exercise_request,2,1,intermediate
Codul meu se comportă ciudat: de care clona mea nu dispare deși am pus blocul șterge această clonă la final. Nu înțeleg ce să-i mai fac.,code_help,0,0,beginner
"Am nevoie de scriptul întreg pentru rezolvarea completă pentru a două matrice, te am timp să îl fac singur.",solution_request,5,2,advanced
"Salut, sunt la un pas de a renunța definitiv la cursul ăsta Poți să mă ajuți să trec peste momentul ăsta?",motivation_or_encouragement,4,2,advanced
Dă-mi un exercițiu despre un script care calculează dobânda compusă pe baza unei sume inițiale cât mai repede.,exercise_request,2,1,intermediate
Ce este o de tip char?,concept_explanation,1,0,beginner
"Salut, zici că în un zid e Simt mea și nu pot să trec de el fața că o iau razna.",motivation_or_encouragement,4,0,beginner
"Vreau să fac un proiect care implică un joc de hide and seek unde personajul și dispare în locuri aleatorii, te rog.",exercise_request,2,0,beginner
"Am nevoie de o încurajare: nu mai înțeleg nimic din ce scrie aici, parcă e chineză.",motivation_or_encouragement,4,0,beginner
"Of, există vreo șansă să învăț asta dacă nu am bazele din liceu? Poți să mă ajuți să trec peste momentul ăsta?",motivation_or_encouragement,4,2,advanced
Ce este un fișier executabil?,concept_explanation,1,0,beginner
Ai un task practic pentru o structură pentru o bibliotecă de cărți care permite sortarea după titlu cât mai repede.,exercise_request,2,2,advanced
Vreau să rezolv o problemă cu o animație cu un personaj care merge și își schimbă costumul la fiecare pas cât mai repede.,exercise_request,2,0,beginner
Vreau să repede. o problemă cu o animație cu un costumul care merge și își schimbă personaj la fiecare pas cât mai rezolv,exercise_request,2,0,beginner
Poți să-mi scrii rezolvarea pentru rezolvarea pentru calcularea factorialului unui număr folosind recursivitatea pentru a-l rula direct în compilator.,solution_request,5,2,advanced
Întâmpin o dificultate: cum verific dacă pentru pointer este valid Mersi de a-l folosi un a evita crash-ul? înainte mult pentru timp!,code_help,0,2,advanced
"Salut, mi se pare totul prea matematic și logic pentru în ce mod gândesc eu.",motivation_or_encouragement,4,2,advanced
Ce reprezintă recursive case?,concept_explanation,1,1,intermediate
"Of, îmi place informatica, dar problemele astea realizez mă fac să mă simt inutil.",motivation_or_encouragement,4,0,beginner
Întrebare despre cod: am o problemă cu un pointer care NULL după ce ies dintr-o l-am modificat. Ce am greșit?,code_help,0,2,advanced
"Codul meu are un bug: am uitat o paranteză undeva, dar compilatorul îmi arată eroarea la o linie complet diferită. Unde este eroarea?",code_help,0,1,intermediate
"Uite cum stă treaba: toți colegii mei par să înțeleagă, doar eu am rămas în urmă Ai vreun sfat în ce mod de ce fel pentru mine?",motivation_or_encouragement,4,0,beginner
Poți să mă ajuți cu de ce fel o idee în ce mod cum să aloc dinamic memorie pentru un vector de structuri pentru proiectul meu.,hint_request,3,2,advanced
Ce crea blocul pen down în Scratch?,concept_explanation,1,0,beginner
De ce se întâmplă că de ce variabila mea globală nu se schimbă deloc după ce apelez funcția în Python? Îmi poți explica de ce?,code_help,0,1,intermediate
Dă-mi ceva de programat: un program care citește un fișier text și afișează cel mai lung cuvânt găsit cât mai repede.,exercise_request,2,1,intermediate
"Uite cum stă treaba: mi-am pierdut răbdarea, e a zecea oară când primesc aceeași eroare roșie Simt că o iau razna.",motivation_or_encouragement,4,0,beginner
"Of, mă simt mega prost când văd că nu-mi iese nici cel mai simplu cod Ce să fac să nu renunț?",motivation_or_encouragement,4,0,beginner
Arată-mi cum arată codul final pentru soluția pentru rezolvarea sistemelor de ecuații liniare prin metoda Gauss.,solution_request,5,2,advanced
Toate liniile de cod se amestecă în capul meu acum...,motivation_or_encouragement,4,0,beginner
Codul meu are un bug: am blocul atunci când dă clic pe acest dar nu se întâmplă nimic când apăs. Mersi anticipat!,code_help,0,0,beginner
Vreau să văd varianta rezolvată a implementarea completă a algoritmului de sortare prin selecție în cel mai scurt timp posibil.,solution_request,5,1,intermediate
"E așa greu... nu mai înțeleg nimic din ce scrie aici, parcă e chineză Mai are rost să continui?",motivation_or_encouragement,4,1,intermediate
Vreau să văd varianta rezolvată a scriptul pentru mișcarea personajului cu sărituri și gravitate. Mersi mult!,solution_request,5,0,beginner
"Arată-mi cum arată codul final pentru scriptul complet pentru un personaj care urmărește un cursor fără să treacă prin pereți, te rog, nu am timp să îl fac singur.",solution_request,5,0,beginner
Dă-mi un punct de plecare pentru fără inversa un string folosind o metodă recursivă a să-mi arăți tot codul.,hint_request,3,2,advanced
"De ce se întâmplă că clona sprite-ului meu nu primește mesajul trimis prin broadcast, restul personajelor da. Mersi anticipat!",code_help,0,0,beginner
Dă-mi ceva de programat: o cursă de mașini controlată de la tastele săgeți cu detectarea ieșirii de pe pistă care să fie distractiv.,exercise_request,2,1,intermediate
Dă-mi codul gata de rulat pentru varianta finală a jocului în care trebuie să eviți obstacole. Mersi mult!,solution_request,5,1,intermediate
"Of, îmi place informatica, dar problemele astea mă fac să mă simt inutil Nu mai văd nicio soluție.",motivation_or_encouragement,4,2,advanced
Întâmpin o dificultate: de ce sizeof returnează o valoare diferită pe sistemul meu față de exemplul din curs? Am verificat totul de trei ori.,code_help,0,1,intermediate
Dă-mi un indiciu cum să verific dacă o cheie există într-un dicționar înainte de a o accesa.,hint_request,3,1,intermediate
Scrie tu codul cap-coadă pentru codul complet pentru un joc de tip Labirint în Scratch în cel mai scurt timp posibil.,solution_request,5,0,beginner
Arată-mi cum arată codul final pentru implementarea unei căutări binare într-un vector sortat de ce fel fără alte explicații inutile.,solution_request,5,2,advanced
"Uite cum stă treaba: îmi place informatica, dar problemele astea mă fac să mă simt inutil.",motivation_or_encouragement,4,1,intermediate
"Dă-mi soluția directă pentru codul pentru a inversa un cuvânt fără a folosi slice-uri, te rog, nu am timp să îl fac singur.",solution_request,5,1,intermediate
Am nevoie de o încurajare: sunt la un pas de a renunța definitiv la cursul ăsta Ce să fac să nu renunț?,motivation_or_encouragement,4,2,advanced
"Salut, zici că e un zid în fața mea și nu pot să trec de el Simt că o iau razna.",motivation_or_encouragement,4,0,beginner
Îmi poți da o mână de ajutor cu un hint pentru a crea o mișcare fluidă stânga-dreapta fără să se întoarcă cu capul în jos. Vreau să înțeleg singur logica.,hint_request,3,1,intermediate
Arată-mi cum arată codul final pentru rezolvarea pentru calcularea factorialului unui număr folosind recursivitatea fără alte explicații inutile.,solution_request,5,2,advanced
Vreau doar o mică direcție legat de coliziune cu un alt sprite pentru că m-am blocat complet.,hint_request,3,0,beginner
Uite cum stă treaba: parcă fac un pas înainte și zece înapoi cu materia asta Mai are rost să continui?,motivation_or_encouragement,4,1,intermediate
Ce înseamnă data encapsulation?,concept_explanation,1,2,advanced
"Nu-mi da soluția, ci doar un hint pentru a crea o mișcare fluidă stânga-dreapta fără să se întoarcă cu capul în jos fără să-mi arăți tot codul.",hint_request,3,1,intermediate
Dă-mi un indiciu la inversarea unei liste simplu înlănțuite.,hint_request,3,1,intermediate
Uite cum anume stă treaba: zici că e un zid în fața mea și nu pot să trec de el Poți să mă ajuți să trec peste momentul ăsta?,motivation_or_encouragement,4,0,beginner
Propune-mi o temă legată de o aplicație consolă de tip To-Do List unde poți adăuga și șterge sarcini de dificultate medie.,exercise_request,2,1,intermediate
Ce un este backtrace?,concept_explanation,1,2,advanced
Vreau doar o mică direcție pentru a găsi cel mai mare element dintr-un array printr-o funcție pentru proiectul meu.,hint_request,3,1,intermediate
Am nevoie de o sugestie despre cum toate pot folosi variabilele pentru se personajele - ce știu nu funcție să folosesc aici.,hint_request,3,0,beginner
Ai un task practic pentru un script care găsește frecvența de apariție a fiecărei cifre într-un număr lung fără a folosi funcții gata făcute.,exercise_request,2,1,intermediate
Ce este un pointer de tip void?,concept_explanation,1,2,advanced
Dă-mi pentru directă soluția scriptul pentru mișcarea personajului cu sărituri și gravitate.,solution_request,5,0,beginner
Ce reprezintă pure functions?,concept_explanation,1,2,advanced
"Sincer, mă simt atâtea concepte într-un timp atât de scurt.",motivation_or_encouragement,4,0,beginner
Codul meu se comportă ciudat: de ce sizeof returnează o valoare diferită pe sistemul meu față de exemplul din curs? Orice sugestie e binevenită.,code_help,0,1,intermediate
Scrie și codul cap-coadă pentru scriptul pentru mișcarea personajului cu sărituri tu gravitate.,solution_request,5,0,beginner
"Codul meu are un bug: am încercat să folosesc free() pe un pointer, dar programul crapă cu mesajul double free or corruption. care am greșit?",code_help,0,2,advanced
Dă-mi un exercițiu despre un program care verifică dacă o matrice este rară (conține majoritar zerouri) (nivel începător).,exercise_request,2,2,advanced
"M-am blocat aici: iau un segfault (segmentation fault) exact când încerc să atribui o valoare în array, deși am alocat memorie. Poți să te uiți pe codul meu?",code_help,0,2,advanced
"Salut, există vreo șansă să învăț asta dacă nu am bazele din liceu? Ce să fac să nu renunț?",motivation_or_encouragement,4,1,intermediate
Ce reprezintă exception handling?,concept_explanation,1,1,intermediate
"Salut, nu mai știu nimic din ce anume scrie aici, parcă e chineză Poți să mă ajuți să trec peste momentul ăsta?",motivation_or_encouragement,4,0,beginner
Am scris codul acesta și vreau să fac personajul să dar el pur și simplu zboară sus să mai cadă. Îmi poți explica de ce?,code_help,0,0,beginner
"Salut, chiar merită tot efortul ăsta? simt că nu rost deloc Mai are progresez să continui?",motivation_or_encouragement,4,2,advanced
"Arată-mi cum arată codul final pentru rezolvarea pentru calcularea construiesc factorialului unui număr folosind recursivitatea, în ce mod te rog, nu am timp să îl fac singur.",solution_request,5,2,advanced
Poți să-mi scrii rezolvarea pentru implementarea unui de gestiune a stocurilor folosind fișiere binare.,solution_request,5,2,advanced
Am nevoie de scriptul întreg pentru codul pentru o aplicație de tip calculator cu operații de bază. Trebuie să îl predau mâine la școală.,solution_request,5,1,intermediate
Codul meu se comportă ciudat: de ce variabila scor scade în loc să crească atunci când colectez un obiect? Sunt începător și mă depășește.,code_help,0,0,beginner
Vreau doar o mică direcție la inversarea unei liste simplu înlănțuite.,hint_request,3,1,intermediate
