text_clean,label,label_id,difficulty,difficulty_name
"Ajutor cu eroarea asta: am eroarea invalid syntax chiar la începutul fișierului, dar codul pare corect. Ce am greșit?",code_help,0,1,intermediate
Dă-mi un exercițiu despre o implementare de listă simplu înlănțuită cu funcție de inserare la final cu explicații la final.,exercise_request,2,1,intermediate
Dă-mi codul gata de rulat pentru soluția pentru un joc de tip Catch the Falling Object. Vreau doar să îi dau copy-paste.,solution_request,5,1,intermediate
Ai un task practic pentru un joc de hide and seek unde personajul apare și locuri în (nivel aleatorii dispare începător).,exercise_request,2,0,beginner
ce blocat la faza obiect? de M-am variabila scor scade în loc să crească atunci când colectez un asta: Am verificat totul de trei ori.,code_help,0,0,beginner
Îmi poți da o aș vrea mână de ajutor cu un hint cum să aloc dinamic memorie pentru un vector de structuri. Vreau sprijin să înțeleg singur logica.,hint_request,3,2,advanced
Ce construi funcția system() în C?,concept_explanation,1,2,advanced
Vreau să văd varianta rezolvată a proiectul gata făcut pentru un ceas digital în Scratch fără alte explicații inutile.,solution_request,5,0,beginner
"Nu mai pot, cred că programarea nu e de mine, sunt prea praf.",motivation_or_encouragement,4,2,advanced
"E așa greu... rămas colegii mei par să înțeleagă, doar eu am toți în urmă.",motivation_or_encouragement,4,0,beginner
"Nu mai pot, prăjit, creierul am nu mai pot să procesez nici măcar un if.",motivation_or_encouragement,4,0,beginner
Codul în ce moment meu se comportă ciudat: la ce moment personajul meu tremură când atinge un obstacol și nu se mai oprește din mișcare. Mersi mult pentru timp!,code_help,0,0,beginner
în ce moment Codul în ce moment meu se comportă ciudat: primesc Bus error: 10 pe Mac când încerc să accesez un element din structură. Sunt începător și mă depășește.,code_help,0,2,advanced
Dă-mi ceva de programat: un program care calculează transpusa unei matrice citite de la tastatură cu explicații la final.,exercise_request,2,2,advanced
Aș vrea un sfat cum să citesc un fișier CSV și să extrag doar o coloană anume. Sunt la început și e greu.,hint_request,3,1,intermediate
Poți să-mi Mersi rezolvarea pentru codul complet pentru un joc de tip Labirint în Scratch. scrii mult!,solution_request,5,0,beginner
Ce în blocul timer face Scratch?,concept_explanation,1,0,beginner
Poți să-mi dai o provocare locuri un a de hide and seek unde personajul apare și dispare în cu aleatorii fără joc folosi funcții gata făcute.,exercise_request,2,0,beginner
Ajutor cu eroarea asta: consola afișează Memory Error imediat după ce introduc datele de intrare. Ce înseamnă? Mersi anticipat!,code_help,0,2,advanced
E așa greu... mi se pare totul prea matematic și logic pentru în ce mod gândesc eu.,motivation_or_encouragement,4,0,beginner
Ce este reference counting? ce anume,concept_explanation,1,2,advanced
"Nu-mi da soluția, ci doar un hint cum să convertesc un șir de caractere în număr întreg manual, te rog frumos.",hint_request,3,1,intermediate
"Codul meu are un bug: media aritmetică îmi dă mereu 0 sau 1, chiar dacă numerele sunt mari. E ceva cu tipul de date? Cum pot repara asta?",code_help,0,1,intermediate
"Scrie tu codul cap-coadă pentru implementarea unui sistem de gestiune a stocurilor folosind fișiere binare, te rog, nu am timp să îl fac singur.",solution_request,5,2,advanced
Arată-mi cum arată codul final pentru implementarea unui sistem de fișiere a stocurilor folosind gestiune binare.,solution_request,5,2,advanced
De ce se întâmplă că personajul meu rămâne blocat în perete și nu mai poate ieși oricât aș apăsa pe taste. Nu găsesc rezolvarea pe Google.,code_help,0,0,beginner
"Uite cum stă treaba: toți colegii mei par să înțeleagă, doar eu am rămas în urmă Ai vreun sfat pentru mine?",motivation_or_encouragement,4,0,beginner
Poți cu dai o provocare cu o structură pentru permite bibliotecă de cărți care o sortarea după titlu să-mi explicații la final.,exercise_request,2,2,advanced
"Am nevoie de o sugestie la algoritmul de sortare a unei liste de dicționare de nivel avansat, dacă se poate.",hint_request,3,1,intermediate
Vreau să fac un proiect implică un joc de tip flappy bird simplificat unde personajul cade gravitațional care să fie distractiv.,exercise_request,2,0,beginner
Uite cum stă treaba: mă simt mega prost când văd că nu-mi iese nici cel mai simplu cod Simt că o iau razna.,motivation_or_encouragement,4,1,intermediate
"Salut, mi-am pierdut răbdarea, aceeași a zecea oară când primesc e eroare roșie.",motivation_or_encouragement,4,0,beginner
Poți să mă ajuți cu o idee referitor la clonarea inamicilor la intervale de timp.,hint_request,3,1,intermediate
Ce sunt care directivele preprocesor (include)?,concept_explanation,1,2,advanced
ce anume Ce reprezintă tipul de date size_t în C?,concept_explanation,1,2,advanced
Vreau să rezolv o eroare cu un joc de hide and seek în ce loc personajul apare și dispare în locuri aleatorii (nivel începător).,exercise_request,2,0,beginner
Dă-mi soluția directă pentru de ce fel cum fac un proiect întreg în care personajele comunică prin mesaje. Trebuie să îl construiesc predau mâine la școală.,solution_request,5,0,beginner
Ai un task practic pentru o implementare de listă simplu înlănțuită cu funcție de inserare la final (nivel începător).,exercise_request,2,1,intermediate
"Nu mai pot, mi-am pierdut răbdarea, e a zecea oară la ce moment primesc aceeași greșeală roșie Spune-mi că o să fie bine.",motivation_or_encouragement,4,2,advanced
Vreau să văd varianta rezolvată a rezolvarea completă pentru calcularea mediei ponderate a unor note.,solution_request,5,1,intermediate
Întâmpin o dificultate: cum verific dacă un pointer este valid înainte de a-l folosi pentru a evita crash-ul? Vreau să înțeleg unde greșesc.,code_help,0,2,advanced
Arată-mi cum arată codul final pentru implementarea unei structuri de date de tip stivă în Python fără alte explicații inutile.,solution_request,5,1,intermediate
Dă-mi soluția directă în cum fac un pentru întreg proiect care personajele comunică prin mesaje. Trebuie să îl predau mâine la școală.,solution_request,5,0,beginner
Am un bug ciudat: de ce primesc multiple definition of dacă am inclus fișierul .c în loc de .h? Este pentru un proiect școlar.,code_help,0,1,intermediate
Dă-mi ceva de programat: o animație cu un personaj care merge și își schimbă costumul la fiecare pas cu explicații la final.,exercise_request,2,0,beginner
Vreau să văd varianta rezolvată a codul sursă pentru un program care inversează un șir de caractere în memorie.,solution_request,5,1,intermediate
Vreau să rezolv problemă cu un joc de flappy bird simplificat unde personajul cade gravitațional fără folosi funcții gata făcute.,exercise_request,2,0,beginner
ce anume este un core dump?,concept_explanation,1,2,advanced
Vreau să fac un proiect care implică un program care calculează transpusa unei matrice citite de la tastatură realizez aș vrea cu explicații la final.,exercise_request,2,2,advanced
Ce reprezintă code obfuscation?,concept_explanation,1,2,advanced
îmi doresc soluția completă pentru rezolvarea completă pentru înmulțirea a două matrice. Trebuie să îl predau mâine la școală.,solution_request,5,2,advanced
Vreau să rezolv o problemă cu o structură pentru o bibliotecă de cărți care permite sortarea după titlu cât mai repede.,exercise_request,2,2,advanced
De ce apare mesajul cum verific dacă un pointer este valid înainte de a-l folosi pentru a evita crash-ul? Sunt începător și mă depășește.,code_help,0,2,advanced
Aș vrea să exersez un joc de hide and seek unde personajul apare și dispare în locuri aleatorii pentru portofoliu.,exercise_request,2,0,beginner
Poți să-mi scrii rezolvarea pentru codul în C pentru determinarea dacă un șir de caractere este palindrom folosind pointeri. Trebuie să îl mâine la școală.,solution_request,5,2,advanced
"Salut, mi-am pierdut răbdarea, e a zecea oară când primesc aceeași eroare roșie.",motivation_or_encouragement,4,0,beginner
Vreau îmi doresc doar o mică direcție pentru a parcurge o matrice folosind doar aritmetica pointerilor pentru că m-am blocat complet.,hint_request,3,2,advanced
E așa greu... mă simt mega prost când văd că nu-mi iese nici cel mai simplu cod Spune-mi că o să fie bine.,motivation_or_encouragement,4,2,advanced
Scrie tu codul cap-coadă pentru codul complet pentru un de tip Labirint în Scratch în cel mai scurt timp posibil.,solution_request,5,0,beginner
Vreau să fac proiect care implică un program în care un sprite întreabă tabla înmulțirii și verifică răspunsul cât repede.,exercise_request,2,0,beginner
Dă-mi să directă pentru codul pentru sortarea unui vector folosind Quicksort. Trebuie soluția îl predau mâine la școală.,solution_request,5,2,advanced
Ce condiție logică?,concept_explanation,1,0,beginner
"Dă-mi ceva de programat: o structură pentru o bibliotecă de cărți care permite sortarea după titlu, te rog.",exercise_request,2,2,advanced
"Nu mai pot, nu mai înțeleg nimic din ce scrie aici, parcă e chineză Poți să mă ajuți să trec peste momentul ăsta?",motivation_or_encouragement,4,0,beginner
"Am nevoie de o încurajare: mi-am pierdut răbdarea, e a zecea oară când primesc aceeași eroare roșie Mai are rost să continui?",motivation_or_encouragement,4,2,advanced
aș vrea să creez un proiect care implică un program în care un sprite întreabă tabla înmulțirii și verifică răspunsul care să fie distractiv.,exercise_request,2,0,beginner
ce anume reprezintă tipul de date size_t în C?,concept_explanation,1,2,advanced
"Nu-mi da soluția, ci doar un hint despre cum se folosește un context manager (with open) pentru scrierea în fișiere pentru proiectul meu.",hint_request,3,1,intermediate
Ce face distance blocul to mouse-pointer?,concept_explanation,1,0,beginner
"Of, mă simt mega prost când văd că nu-mi iese nici cel mai simplu cod ce anume să realizez să nu renunț?",motivation_or_encouragement,4,0,beginner
M-am blocat la faza asta: cum accesez un membru dintr-un pointer către o structură fără să folosesc operatorul -? Am verificat totul de trei ori.,code_help,0,2,advanced
Vreau soluția completă pentru implementarea unei căutări binare într-un vector sortat.,solution_request,5,2,advanced
Codul meu se comportă ciudat: compilatorul spune file not found pentru un header pe care l-am creat în același folder. Mersi mult pentru timp!,code_help,0,1,intermediate
Ce este type inference?,concept_explanation,1,2,advanced
Ce înseamnă method overloading vs overriding?,concept_explanation,1,2,advanced
Ce reprezintă tipul de ce anume date size_t în C?,concept_explanation,1,2,advanced
"Codul meu are care ce anume un bug: am încercat să folosesc free() pe un pointer, dar programul crapă cu mesajul double free or corruption. Ce am greșit?",code_help,0,2,advanced
Am un bug ciudat: primesc Bus error: 10 pe Mac în ce moment încerc să accesez un element din structură. Este pentru un proiect școlar.,code_help,0,2,advanced
M-am blocat la faza asta: am o eroare de link-editare (linker error) deși codul sursă nu are nicio eroare de sintaxă. Se poate rezolva fără a rescrie tot?,code_help,0,2,advanced
"Nu mai pot, există vreo șansă învăț asta dacă nu am bazele din liceu? Ce să fac să nu",motivation_or_encouragement,4,0,beginner
Vreau să văd varianta rezolvată a codul pentru un sistem de schimbare a nivelurilor bazat pe punctaj. Mersi mult!,solution_request,5,1,intermediate
Ce înseamnă lexical analysis?,concept_explanation,1,2,advanced
Dă-mi un punct de plecare legat de utilizarea list comprehension pentru a filtra numere prime.,hint_request,3,1,intermediate
"Aș vrea să exersez un program în care un tabla întreabă sprite înmulțirii și verifică răspunsul, te rog.",exercise_request,2,0,beginner
"Dă-mi soluția directă pentru codul pentru un simulator de desenat poligoane regulate, te rog, nu am timp să îl fac singur.",solution_request,5,1,intermediate
Dă-mi un exercițiu despre un program care verifică dacă o matrice este rară (conține majoritar zerouri) pentru portofoliu.,exercise_request,2,2,advanced
Vreau să văd varianta rezolvată a codul complet pentru un joc de tip în Scratch. Mersi mult!,solution_request,5,0,beginner
Dă-mi ceva de programat: un program care citește un fișier text și afișează cel mai lung cuvânt găsit cu explicații la final.,exercise_request,2,1,intermediate
Vreau să văd varianta rezolvată a fac un proiect întreg în care personajele comunică prin mesaje. Mersi mult!,solution_request,5,0,beginner
"Uite cum stă treaba: nu mai înțeleg nimic din ce scrie aici, parcă e chineză Poți să mă ajuți să trec peste momentul ăsta?",motivation_or_encouragement,4,0,beginner
Am nevoie de o sugestie pentru rezolvarea problemei palindromului fără a folosi slicing.,hint_request,3,1,intermediate
Ce este un malloc în C?,concept_explanation,1,2,advanced
"Nu mai pot, mi-am pierdut răbdarea, e a zecea oară în ce moment primesc aceeași greșeală roșie Spune-mi că o să fie bine.",motivation_or_encouragement,4,2,advanced
"Salut, parcă fac un pas înainte și realizez zece înapoi cu materia asta Ce să fac să nu renunț?",motivation_or_encouragement,4,2,advanced
Ce if reprezintă statement?,concept_explanation,1,0,beginner
Ce reprezintă tail recursion?,concept_explanation,1,2,advanced
Am nevoie de o sugestie în ce mod să aloc dinamic memorie pentru un vector de structuri - nu pricep ce funcție să folosesc aici.,hint_request,3,2,advanced
Vreau să văd varianta rezolvată a soluția pentru sistemelor rezolvarea de ecuații liniare prin metoda Gauss pentru a-l rula direct în compilator.,solution_request,5,2,advanced
doresc să realizez un proiect care implică un algoritm de căutare binară implementat recursiv pentru un vector sortat cu explicații la final.,exercise_request,2,2,advanced
Ce face funcția vars() construi în Python?,concept_explanation,1,2,advanced
doresc să creez un proiect care implică o animație cu un personaj care merge și își schimbă costumul la fiecare pas (nivel începător).,exercise_request,2,0,beginner
"Mă simt groaznic, mi trec pare totul prea matematic peste logic pentru cum gândesc eu Poți să mă ajuți să se și momentul ăsta?",motivation_or_encouragement,4,0,beginner
M-am blocat la faza asta: de care clona mea nu dispare deși am pus blocul șterge această clonă la final. Am verificat totul de trei ori.,code_help,0,0,beginner
Ce reprezintă un deadlock în execuția programelor?,concept_explanation,1,2,advanced
"Scrie tu codul cap-coadă pentru rezolvarea pentru un joc cu scor și vieți care se resetează, te rog, nu am timp să îl fac singur.",solution_request,5,1,intermediate
Ce înseamnă logic error?,concept_explanation,1,0,beginner
Am nevoie de scriptul întreg pentru codul pentru un sistem de schimbare a nivelurilor bazat pe punctaj. Trebuie să îl predau mâine la școală.,solution_request,5,1,intermediate
"Am nevoie astea o încurajare: îmi place de dar problemele informatica, mă fac să mă simt inutil Mai are rost să continui?",motivation_or_encouragement,4,2,advanced
"Arată-mi cum arată codul final pentru codul în C pentru determinarea dacă un șir de caractere este palindrom folosind pointeri, te rog, nu am timp să îl fac singur.",solution_request,5,2,advanced
în care parte Dă-mi un exercițiu despre un instrument muzical virtual unde clapele sunt sprite-uri diferite cât mai repede.,exercise_request,2,0,beginner
Vreau să rezolv o problemă cu o cursă de mașini controlată de la tastele săgeți cu detectarea ieșirii de pe pistă cu explicații la final.,exercise_request,2,1,intermediate
M-am blocat la faza asta: de ce variabila scor atunci în loc să crească scade când colectez mult obiect? Mersi un pentru timp!,code_help,0,0,beginner
Vreau să fac un proiect care implică o funcție care verifică dacă două șiruri de caractere sunt anagrame fără a folosi funcții gata făcute.,exercise_request,2,1,intermediate
Dă-mi ceva de programat: un joc de tip flappy bird simplificat în ce loc personajul cade gravitațional fără a folosi funcții gata făcute.,exercise_request,2,0,beginner
M-am blocat la faza asta: de ce variabila scor scade în loc să crească atunci când colectez un obiect? Mersi mult pentru timp!,code_help,0,0,beginner
Arată-mi cum arată codul final pentru rezolvarea pentru calcularea factorialului unui număr folosind recursivitatea pentru a-l rula direct în compilator.,solution_request,5,2,advanced
M-am blocat la faza asta: încerc să sortez o listă care conține și numere și string-uri și primesc TypeError. Am verificat totul de trei ori.,code_help,0,1,intermediate
"Ajutor, vă rog! mică ce realloc îmi dă crash dacă totul nouă este mai de decât cea veche? Am verificat dimensiunea de trei ori.",code_help,0,2,advanced
Ce face până repetă blocul când în Scratch?,concept_explanation,1,0,beginner
Ce care este memory alignment?,concept_explanation,1,2,advanced
"Vreau să văd varianta rezolvată a codul sursă pentru un program care inversează un șir de caractere în memorie, te rog, nu am timp să îl fac singur.",solution_request,5,1,intermediate
"Aș vrea un sfat cum să folosesc un mesaj broadcast ca să pornesc nivelul 2, te rog frumos.",hint_request,3,1,intermediate
reprezintă array index?,concept_explanation,1,0,beginner
de ce fel Am nevoie de o sugestie despre cum se pot folosi variabilele pentru toate personajele pentru proiectul meu.,hint_request,3,0,beginner
Dă-mi un punct de plecare folosi cum se pot despre variabilele pentru toate personajele pentru că m-am blocat complet.,hint_request,3,0,beginner
Poți să mă ajuți cu o idee despre cum se folosește un context manager (with open) pentru scrierea în fișiere fără să-mi arăți tot codul.,hint_request,3,1,intermediate
"Întrebare despre cod: am eroarea invalid syntax chiar la începutul fișierului, dar codul pare corect. Mersi anticipat!",code_help,0,1,intermediate
Ce un este pointer to array?,concept_explanation,1,2,advanced
"Aș vrea un sfat cum să detectez când mouse-ul este apăsat deasupra unui buton, te rog frumos.",hint_request,3,1,intermediate
Aș vrea un sfat ca să fac un cronometru care scade în timp ce joc pentru că m-am blocat complet.,hint_request,3,1,intermediate
Ce înseamnă indexarea ce anume de la zero?,concept_explanation,1,0,beginner
Am nevoie de scriptul întreg pentru codul complet pentru un joc de tip Labirint în Scratch. Vreau doar să îi dau copy-paste.,solution_request,5,0,beginner
Dă-mi un exercițiu despre un script care convertește temperatura din Celsius în Fahrenheit și invers (nivel începător).,exercise_request,2,1,intermediate
"Sincer, mi-am pierdut răbdarea, e a zecea oară când primesc aceeași eroare roșie Nu mai văd nicio soluție.",motivation_or_encouragement,4,1,intermediate
cum arată codul final codul complet pentru un joc de tip Labirint în Scratch în cel mai timp posibil.,solution_request,5,0,beginner
Uite cum stă treaba: e frustrant să stai ore întregi pentru un punct și virgulă lipsă Ai vreun sfat pentru mine?,motivation_or_encouragement,4,0,beginner
Propune-mi o temă legată de un script care găsește frecvența de apariție a fiecărei cifre într-un număr lung cu explicații la final.,exercise_request,2,1,intermediate
"Sincer, parcă fac un pas înainte și zece cu materia asta.",motivation_or_encouragement,4,0,beginner
"E așa greu... nu mai înțeleg nimic din ce scrie aici, parcă e chineză Ce să fac să nu renunț?",motivation_or_encouragement,4,2,advanced
doresc soluția completă pentru codul pentru sortarea unui vector folosind Quicksort.,solution_request,5,2,advanced
E așa greu... e frustrant punct stai mai întregi pentru un să și virgulă lipsă Nu ore văd nicio soluție.,motivation_or_encouragement,4,0,beginner
"Nu mai pot, m-am blocat și simt că intru în panică pentru că se apropie examenul.",motivation_or_encouragement,4,0,beginner
Vreau să văd varianta rezolvată a implementarea unui sistem de gestiune a stocurilor folosind fișiere binare. Trebuie să îl predau mâine la școală.,solution_request,5,2,advanced
Vreau să fac un proiect care implică un utilitar care concatenează două fișiere text într-un al treilea pentru portofoliu.,exercise_request,2,1,intermediate
Propune-mi o temă legată de un script care convertește temperatura din Celsius în Fahrenheit și invers pentru portofoliu.,exercise_request,2,1,intermediate
"De ce se întâmplă că clona sprite-ului da. nu primește mesajul trimis prin broadcast, restul personajelor meu Mersi anticipat!",code_help,0,0,beginner
"Salut, mi-am pierdut răbdarea, e a zecea oară când primesc aceeași eroare problemă roșie.",motivation_or_encouragement,4,0,beginner
Aș vrea să exersez un program în care un sprite întreabă tabla înmulțirii și verifică răspunsul pentru portofoliu.,exercise_request,2,0,beginner
Ce înseamnă duck typing?,concept_explanation,1,2,advanced
Vreau să fac un proiect care implică un joc de hide and distractiv. dispare personajul apare și unde în locuri aleatorii care să fie seek,exercise_request,2,0,beginner
"Mă simt groaznic, există vreo șansă să învăț asta dacă nu am bazele din liceu? E normal să mă simt așa la început?",motivation_or_encouragement,4,2,advanced
Ce înseamnă shallow copy vs deep copy?,concept_explanation,1,2,advanced
"Mă simt groaznic, toți colegii mei par să înțeleagă, doar eu am rămas în urmă Mai are rost să continui?",motivation_or_encouragement,4,2,advanced
Scrie tu codul cap-coadă pentru soluția pentru rezolvarea sistemelor de ecuații liniare prin metoda Gauss. Vreau doar să îi dau copy-paste.,solution_request,5,2,advanced
"Salut, parcă fac un pas înainte și zece înapoi cu materia asta Ce să fac să nu renunț?",motivation_or_encouragement,4,2,advanced
"Sincer, îmi vine să plâng de nervi se nu că compilează programul.",motivation_or_encouragement,4,2,advanced
Dă-mi un punct de plecare legat de folosirea operatorului modulo pentru a afla restul împărțirii.,hint_request,3,1,intermediate
"Dă-mi un indiciu pentru a găsi cel mai mare element dintr-un array printr-o funcție, te rog frumos.",hint_request,3,1,intermediate
logic error?,concept_explanation,1,0,beginner
"Nu mai pot, cred că programarea nu e de mine, sunt praf. prea",motivation_or_encouragement,4,2,advanced
Poți să-mi dai o provocare cu un joc de hide în ce loc and seek unde în care parte personajul apare și dispare în locuri aleatorii cât mai repede.,exercise_request,2,0,beginner
Dă-mi codul gata de rulat pentru implementarea unui sistem de gestiune a stocurilor folosind fișiere binare fără alte explicații inutile.,solution_request,5,2,advanced
"Nu pricep eroarea asta: am un memory leak raportat de Valgrind, dar am dat free la toate variabilele principale. Sunt începător și mă depășește.",code_help,0,2,advanced
care să fac înmulțirii proiect Vreau implică un program în care un sprite întreabă tabla un și verifică răspunsul (nivel începător).,exercise_request,2,0,beginner
Vreau să a varianta rezolvată văd implementarea unei căutări binare într-un vector sortat pentru a-l rula direct în compilator.,solution_request,5,2,advanced
Am nevoie de o încurajare: m-am blocat și intru că simt în panică pentru că se apropie examenul nicio mai văd Nu soluție.,motivation_or_encouragement,4,2,advanced
Am nevoie de scriptul întreg pentru scriptul pentru mișcarea personajului cu sărituri și gravitate. Vreau doar să îi dau copy-paste.,solution_request,5,0,beginner
Îmi puteți spune de ce cum verific dacă un pointer este valid înainte de a-l folosi pentru a evita crash-ul? Sunt începător și mă depășește.,code_help,0,2,advanced
Ce înseamnă inline function?,concept_explanation,1,2,advanced
Ce valoare este o variabilă externă (extern)?,concept_explanation,1,2,advanced
"De ce se întâmplă că în loc de text, în consolă apar doar niște pătrățele și simboluri ciudate. Cum pot repara asta?",code_help,0,1,intermediate
Ai un task practic pentru un proiect în care un liliac urmărește un fluture folosind blocul glide pentru portofoliu.,exercise_request,2,1,intermediate
E așa greu... e frustrant să stai ore întregi pentru un punct și virgulă lipsă Nu mai văd nicio soluție.,motivation_or_encouragement,4,0,beginner
Poți să-mi dai o provocare cu o cursă de mașini controlată de la tastele săgeți cu detectarea ieșirii de pe pistă fără a folosi funcții gata făcute.,exercise_request,2,1,intermediate
Ce este dynamic typing?,concept_explanation,1,1,intermediate
ce anume face blocul pen down în Scratch?,concept_explanation,1,0,beginner
Dă-mi codul gata de rulat pentru rezolvarea completă pentru calcularea mediei ponderate a unor note. Sunt blocat de ore întregi și am nevoie de cod.,solution_request,5,1,intermediate
"De ce se întâmplă că clona sprite-ului meu nu primește mesajul trimis prin broadcast, restul da. Ce am greșit?",code_help,0,0,beginner
Poți să-mi scrii rezolvarea codul complet pentru un joc de tip Labirint în Scratch. Mersi mult!,solution_request,5,0,beginner
Ce este un docstring?,concept_explanation,1,1,intermediate
